{
  "schemaVersion": "1.1",
  "generatedAt": "2026-09-10T06:19:54.982Z",
  "source": {
    "kind": "github",
    "ref": "master",
    "commit": "aa8262ec091698bae9a6b04773a6b5b06ad4aef2"
  },
  "dsh": {
    "packageVersion": "0.1.5-rc.1",
    "codexPin": "0.153.4"
  },
  "codex": {
    "targetVersion": "0.154.0"
  },
  "summary": {
    "status": "incompatible",
    "findingCounts": {
      "breaking": 1,
      "review": 0
    },
    "schemaFiles": {
      "baseline": 304,
      "target": 305,
      "added": 1,
      "removed": 0,
      "changed": 26
    }
  },
  "findings": [
    {
      "id": "codex-error-string-pinned-unhandled",
      "severity": "breaking",
      "scope": "baseline",
      "title": "Pinned Codex string error categories degrade to unknown",
      "values": [
        "rateLimitExceeded"
      ],
      "remediation": "Map every string error category already present in the pinned Codex dependency in failureInfo() and add union-completeness coverage."
    }
  ],
  "protocol": {
    "codexErrors": {
      "baseline": {
        "strings": [
          "badRequest",
          "contextWindowExceeded",
          "cyberPolicy",
          "internalServerError",
          "misalignmentPolicyViolation",
          "other",
          "rateLimitExceeded",
          "sandboxError",
          "serverOverloaded",
          "sessionBudgetExceeded",
          "threadRollbackFailed",
          "unauthorized",
          "usageLimitExceeded"
        ],
        "objects": [
          "activeTurnNotSteerable",
          "httpConnectionFailed",
          "responseStreamConnectionFailed",
          "responseStreamDisconnected",
          "responseTooManyFailedAttempts"
        ]
      },
      "target": {
        "strings": [
          "badRequest",
          "contextWindowExceeded",
          "cyberPolicy",
          "internalServerError",
          "misalignmentPolicyViolation",
          "other",
          "rateLimitExceeded",
          "sandboxError",
          "serverOverloaded",
          "sessionBudgetExceeded",
          "threadRollbackFailed",
          "unauthorized",
          "usageLimitExceeded"
        ],
        "objects": [
          "activeTurnNotSteerable",
          "httpConnectionFailed",
          "responseStreamConnectionFailed",
          "responseStreamDisconnected",
          "responseTooManyFailedAttempts"
        ]
      },
      "handledByDsh": {
        "strings": [
          "badRequest",
          "contextWindowExceeded",
          "cyberPolicy",
          "internalServerError",
          "misalignmentPolicyViolation",
          "other",
          "sandboxError",
          "serverOverloaded",
          "sessionBudgetExceeded",
          "threadRollbackFailed",
          "unauthorized",
          "usageLimitExceeded"
        ],
        "objects": [
          "activeTurnNotSteerable",
          "httpConnectionFailed",
          "responseStreamConnectionFailed",
          "responseStreamDisconnected",
          "responseTooManyFailedAttempts"
        ]
      },
      "baselineUnhandled": {
        "strings": [
          "rateLimitExceeded"
        ],
        "objects": []
      },
      "added": {
        "strings": [],
        "objects": []
      }
    },
    "serverRequests": {
      "baseline": [
        "account/chatgptAuthTokens/refresh",
        "applyPatchApproval",
        "attestation/generate",
        "execCommandApproval",
        "item/commandExecution/requestApproval",
        "item/fileChange/requestApproval",
        "item/permissions/requestApproval",
        "item/tool/call",
        "item/tool/requestUserInput",
        "mcpServer/elicitation/request"
      ],
      "target": [
        "account/chatgptAuthTokens/refresh",
        "applyPatchApproval",
        "attestation/generate",
        "execCommandApproval",
        "item/commandExecution/requestApproval",
        "item/fileChange/requestApproval",
        "item/permissions/requestApproval",
        "item/tool/call",
        "item/tool/requestUserInput",
        "mcpServer/elicitation/request"
      ],
      "added": [],
      "handledByDsh": [
        "item/commandExecution/requestApproval",
        "item/fileChange/requestApproval",
        "item/permissions/requestApproval",
        "item/tool/requestUserInput",
        "mcpServer/elicitation/request"
      ]
    },
    "schemaDiff": {
      "added": [
        "v2/NullableGetAccountRateLimitsParams.json"
      ],
      "removed": [],
      "changed": [
        "ClientRequest.json",
        "PermissionsRequestApprovalParams.json",
        "ServerNotification.json",
        "ServerRequest.json",
        "codex_app_server_protocol.schemas.json",
        "codex_app_server_protocol.v2.schemas.json",
        "v2/AccountRateLimitsUpdatedNotification.json",
        "v2/ConfigRequirementsReadResponse.json",
        "v2/GetAccountRateLimitsResponse.json",
        "v2/ItemGuardianApprovalReviewCompletedNotification.json",
        "v2/ItemGuardianApprovalReviewStartedNotification.json",
        "v2/ListMcpServerStatusResponse.json",
        "v2/RawResponseItemCompletedNotification.json",
        "v2/ReviewStartParams.json",
        "v2/ThreadForkResponse.json",
        "v2/ThreadListParams.json",
        "v2/ThreadListResponse.json",
        "v2/ThreadMetadataUpdateResponse.json",
        "v2/ThreadReadResponse.json",
        "v2/ThreadResumeParams.json",
        "v2/ThreadResumeResponse.json",
        "v2/ThreadRevertResponse.json",
        "v2/ThreadRollbackResponse.json",
        "v2/ThreadStartResponse.json",
        "v2/ThreadStartedNotification.json",
        "v2/ThreadUnarchiveResponse.json"
      ]
    }
  }
}
